{
  "name": "Shared production agents and Rust learning path",
  "goals": [
    "Build better autonomous agents in production through reliable tool and worker contracts",
    "Deepen Rust type-system design",
    "Explore infrastructure configuration with Rust and robotics"
  ],
  "topics": [
    "types",
    "production-reliability",
    "async",
    "infrastructure",
    "robotics"
  ],
  "available_windows": [],
  "registered_workshops": [],
  "attendance_mode": null
}
